{
  "feature_id": "REQ-053",
  "verdict": "PROVEN",
  "justification": "REQ-053 claims /ship is one delivery narrative. The runtime persists one ShipTreatment across phases, while the emitted command directs agents through the same state, bounded review, exact-subject evidence, acceptance-fit, and landing contract. The rendered-template tests prove the contract across governance levels and language configurations without embedding divergent stack-specific orchestration. Executed for this verdict: 15 passed.",
  "command": "npx vitest run __tests__/templates/commands-claude.test.ts",
  "transcript_digest": "c1ce1581745e97721e19e9409fb78d2750ffdb486f9a365c75d861493c9c1db0",
  "citations": [
    "src/commands/task-ship.ts#L1-L30@0a306660016e",
    "__tests__/templates/commands-claude.test.ts#L1-L25@6e927613ddbd"
  ],
  "recorded_at": "2026-09-15T20:56:19Z"
}
